{
  "$schema": "https://json-schema.org/draft/2020-12/schema",
  "$id": "opportunity.schema.json",
  "title": "Opportunity",
  "description": "A Programme offered for a particular intake, campus and teaching language. This is the smallest thing a student can actually assess or save, and the unit the whole product is built around.",
  "type": "object",
  "required": [
    "id",
    "programme",
    "institution",
    "destination",
    "intake",
    "language",
    "meta"
  ],
  "properties": {
    "id": {
      "$ref": "common.schema.json#/$defs/id"
    },
    "programme": {
      "$ref": "common.schema.json#/$defs/id"
    },
    "institution": {
      "$ref": "common.schema.json#/$defs/id"
    },
    "destination": {
      "$ref": "common.schema.json#/$defs/id"
    },
    "place": {
      "$ref": "common.schema.json#/$defs/id"
    },
    "intake": {
      "$ref": "common.schema.json#/$defs/intake"
    },
    "startMonth": {
      "type": "string"
    },
    "language": {
      "type": "object",
      "required": [
        "instruction"
      ],
      "properties": {
        "instruction": {
          "type": "string",
          "description": "The language the Programme is actually taught in."
        },
        "fullyInLanguage": {
          "type": "boolean",
          "description": "False where only part of the degree is in this language — a common and consequential trap."
        },
        "intakeStatus": {
          "enum": ["confirmed", "unconfirmed"],
          "description": "Whether the listed teaching language is confirmed for this Opportunity's intake. Omit to retain the existing listed-language behaviour. Unconfirmed requires a sourced explanatory note; it does not mean partial teaching, a confirmed different language, or no offering."
        },
        "note": {
          "type": "string"
        }
      },
      "additionalProperties": false,
      "anyOf": [
        { "properties": { "intakeStatus": { "const": "confirmed" } } },
        {
          "required": ["intakeStatus", "note"],
          "properties": {
            "intakeStatus": { "const": "unconfirmed" },
            "note": { "type": "string", "pattern": "\\S" }
          }
        }
      ]
    },
    "admission": {
      "type": "object",
      "properties": {
        "restricted": {
          "type": "boolean",
          "description": "True where meeting the requirements does not guarantee a place."
        },
        "capacityNote": {
          "type": "string"
        },
        "selection": {
          "type": "array",
          "description": "How eligible applicants are ranked. Kept computationally separate from eligibility — a cut-off is not a requirement.",
          "items": {
            "type": "object",
            "required": [
              "type"
            ],
            "properties": {
              "type": {
                "enum": [
                  "gpa",
                  "subject-grades",
                  "essay",
                  "interview",
                  "portfolio",
                  "audition",
                  "test",
                  "work-experience",
                  "lottery",
                  "other"
                ]
              },
              "description": {
                "type": "string"
              },
              "weight": {
                "type": "string"
              },
              "evidence": {
                "$ref": "common.schema.json#/$defs/evidenceRefs"
              }
            },
            "additionalProperties": false
          }
        },
        "historicalCutoffs": {
          "type": "array",
          "description": "Past cut-offs are context for how competitive something has been. They are never treated as a requirement and never used to predict an offer.",
          "items": {
            "type": "object",
            "required": [
              "intake",
              "value"
            ],
            "properties": {
              "intake": {
                "$ref": "common.schema.json#/$defs/intake"
              },
              "quota": {
                "type": "string"
              },
              "value": {
                "type": "string"
              },
              "scale": {
                "type": "string"
              },
              "evidence": {
                "$ref": "common.schema.json#/$defs/evidenceRefs"
              }
            },
            "additionalProperties": false
          }
        },
        "numerusFixus": {
          "type": "boolean",
          "description": "True where places are capped by a numerus fixus and the programme applies its closing date (the Netherlands' 15 January); false where the institution lists the programme as not numerus fixus. Omit when unknown. Dates marked `numerusFixusOnly` are left off a programme recorded false."
        }
      },
      "additionalProperties": false
    },
    "requirements": {
      "type": "array",
      "description": "Machine-readable rules paired with the source's own wording.",
      "items": {
        "$ref": "#/$defs/requirement"
      }
    },
    "officialRequirementsText": {
      "type": "array",
      "description": "The requirement paragraph as published, kept verbatim so a counsellor can audit our normalisation.",
      "items": {
        "$ref": "common.schema.json#/$defs/localisedText"
      }
    },
    "cost": {
      "type": "array",
      "description": "One entry per applicant group, because the same Opportunity costs different people very different amounts.",
      "items": {
        "type": "object",
        "required": [
          "applicantGroup",
          "feeStatus"
        ],
        "properties": {
          "applicantGroup": {
            "$ref": "common.schema.json#/$defs/applicantGroup"
          },
          "feeStatus": {
            "$ref": "common.schema.json#/$defs/feeStatus"
          },
          "tuition": {
            "$ref": "common.schema.json#/$defs/money"
          },
          "mandatoryFees": {
            "type": "array",
            "items": {
              "type": "object",
              "required": [
                "label",
                "amount"
              ],
              "properties": {
                "label": {
                  "type": "string"
                },
                "amount": {
                  "$ref": "common.schema.json#/$defs/money"
                }
              },
              "additionalProperties": false
            }
          },
          "priceYear": {
            "type": "string",
            "description": "The academic year the figure was published for. Required honesty: never present an old figure as current."
          },
          "evidence": {
            "$ref": "common.schema.json#/$defs/evidenceRefs"
          }
        },
        "additionalProperties": false
      }
    },
    "applicationRoutes": {
      "type": "array",
      "items": {
        "$ref": "common.schema.json#/$defs/id"
      }
    },
    "outcomePathway": {
      "type": "object",
      "properties": {
        "accreditation": {
          "type": "string"
        },
        "professionalRecognition": {
          "type": "string"
        },
        "furtherStudy": {
          "type": "string"
        },
        "workRoutes": {
          "type": "string"
        },
        "evidence": {
          "$ref": "common.schema.json#/$defs/evidenceRefs"
        }
      },
      "additionalProperties": false
    },
    "evidence": {
      "$ref": "common.schema.json#/$defs/evidenceRefs"
    },
    "meta": {
      "$ref": "common.schema.json#/$defs/recordMeta"
    }
  },
  "additionalProperties": false,
  "$defs": {
    "requirement": {
      "type": "object",
      "required": [
        "id",
        "kind",
        "mandatory"
      ],
      "properties": {
        "id": {
          "$ref": "common.schema.json#/$defs/id"
        },
        "kind": {
          "enum": [
            "ib-diploma",
            "ib-course-results",
            "ib-total-points",
            "ib-subject",
            "subject-combination",
            "local-equivalency",
            "language-general",
            "language-programme",
            "test",
            "portfolio",
            "audition",
            "interview",
            "essay",
            "reference",
            "work-sample",
            "activity",
            "citizenship",
            "residency",
            "age",
            "prior-education",
            "application-round",
            "quota",
            "other",
            "minimum-average"
          ]
        },
        "mandatory": {
          "type": "boolean",
          "description": "False marks a Selection Factor — used in ranking, not in eligibility."
        },
        "label": {
          "type": "string",
          "description": "Student-readable, e.g. 'Mathematics at A level'."
        },
        "officialWording": {
          "$ref": "common.schema.json#/$defs/localisedText"
        },
        "ibSubject": {
          "type": "string",
          "description": "For kind 'ib-subject'. An IB subject id or name from data/ib-subjects.json. This is the default way to write a requirement and it needs no Recognition Scheme: the source said HL and the student has HL, so there is nothing to translate."
        },
        "ibLevel": {
          "$ref": "common.schema.json#/$defs/ibLevel",
          "description": "For kind 'ib-subject'. HL, SL, or 'any' where the source accepts either."
        },
        "subject": {
          "type": "string",
          "description": "For kind 'local-equivalency'. A subject name in the vocabulary of the scale named by `levelScale` — the source's own word, not ours."
        },
        "levelScale": {
          "type": "string",
          "description": "For kind 'local-equivalency'. The id of the subject scale `level` is measured on, matching a Recognition Scheme's subjectScale.id. A level with no scale is a number with no unit: 'A' means the top of three levels in one country and the top of five in another, and a requirement that does not say which cannot be checked."
        },
        "level": {
          "type": "string",
          "minLength": 1,
          "maxLength": 16,
          "description": "For kind 'local-equivalency'. A level code the scale named by `levelScale` defines."
        },
        "minGrade": {
          "type": "number",
          "description": "On the scale named by `gradeScale` for a local-equivalency rule, or the IB's own 1-7 scale for an ib-subject rule. On an ib-course-results rule it is the IB grade every subject in the award must reach, not one named subject."
        },
        "minGradeWaivedAtLevel": {
          "type": "string",
          "description": "For a local-equivalency rule with a minGrade: the level on the same scale at which the minimum no longer applies — ITU and CBS publish \"no grade requirement if [the subject] at A-level is passed\". A student whose IB subject counts at this level or above meets the rule with any passing grade."
        },
        "gradeScale": {
          "type": "string",
          "description": "The id of the grade scale `minGrade` is measured on, matching a Recognition Scheme's gradeScale.id. Omitted on an ib-subject rule, where the scale is the IB's."
        },
        "minPoints": {
          "type": "integer",
          "minimum": 0,
          "maximum": 45
        },
        "minSubjects": {
          "type": "integer",
          "minimum": 1,
          "maximum": 6,
          "description": "For kind 'ib-course-results'. How many graded IB subjects the award must contain for it to qualify. Course Results are not awarded against a fixed shape the way a Diploma is, so a source that accepts them usually says how many subjects it wants to see."
        },
        "minHigherLevelSubjects": {
          "type": "integer",
          "minimum": 0,
          "maximum": 6,
          "description": "For kind 'ib-course-results'. How many of those subjects must be at HL."
        },
        "alternativeRoute": {
          "type": "string",
          "description": "For a rule an applicant cannot satisfy as they stand, the published route that still reaches this Opportunity — supplementary subjects, a retake, a different entry qualification. Only ever the source's own route, never our suggestion, and covered by the same `evidence` as the rule itself. Its reason for existing is that 'you do not meet this' and 'this is closed to you' are different sentences, and a rule that can only say the first of them tells a student to stop when the source did not."
        },
        "alternativeRouteSummary": {
          "type": "object",
          "description": "`alternativeRoute` in one sentence, for lists that show many programmes at once (/guides/course-results/, the finder's card label). Says nothing the long text does not. Programmes whose routes read the same share the same `short`, and a list shows it once.",
          "required": [
            "short",
            "reachesAtEighteen"
          ],
          "properties": {
            "short": {
              "type": "string",
              "minLength": 20,
              "maxLength": 220
            },
            "withinIntake": {
              "type": "boolean",
              "description": "True only where the long text shows the route can be completed after the IB results and in time for this Opportunity's intake. Absent is read as false: a route that needs further study after the results points to a later intake, and \"Possible with action\" is not said of it."
            },
            "reachesAtEighteen": {
              "type": "boolean",
              "description": "True when the long text describes a way in without the full Diploma that is open without waiting for an age limit (a supplement, a test anyone may sit). False when every such route waits for an age (typically 21) or none is published, which the long text then says."
            }
          },
          "additionalProperties": false
        },
        "operator": {
          "enum": [
            "all-of",
            "one-of",
            "at-least",
            "at-most",
            "equals",
            "exists"
          ],
          "description": "How to evaluate `alternatives` or the threshold."
        },
        "alternatives": {
          "type": "array",
          "description": "Each element is a set of requirements; satisfying any one set satisfies the rule.",
          "items": {
            "type": "array",
            "items": {
              "$ref": "#/$defs/requirement"
            }
          }
        },
        "applicability": {
          "type": "object",
          "description": "Who and when the rule binds. Without this a rule is not safely usable.",
          "properties": {
            "intake": {
              "$ref": "common.schema.json#/$defs/intake"
            },
            "applicantGroup": {
              "$ref": "common.schema.json#/$defs/applicantGroup"
            },
            "feeStatus": {
              "$ref": "common.schema.json#/$defs/feeStatus"
            },
            "qualificationVersion": {
              "type": "string"
            },
            "exception": {
              "type": "string"
            }
          },
          "additionalProperties": false
        },
        "satisfiedBy": {
          "type": "array",
          "description": "Named alternative ways to meet it — a language test in place of a subject, for instance.",
          "items": {
            "type": "string"
          }
        },
        "preparationActions": {
          "type": "array",
          "items": {
            "$ref": "common.schema.json#/$defs/id"
          },
          "description": "What a student could still do about this gap."
        },
        "note": {
          "type": "string"
        },
        "evidence": {
          "$ref": "common.schema.json#/$defs/evidenceRefs"
        },
        "minAverage": {
          "type": "number",
          "description": "For kind 'minimum-average': the lowest average on the grade scale named by `gradeScale`. Without `averageOf` it is the qualifying exam's overall average (for an IB Diploma, the total converted by the Recognition Scheme's average table); with it, the average of those subjects' converted grades."
        },
        "averageOf": {
          "type": "array",
          "minItems": 1,
          "description": "For kind 'minimum-average': the subjects whose grades are averaged, on a local subject scale — AU's \"6.0 in Mathematics A\", RUC's \"4.0 in the subjects English and Mathematics\".",
          "items": {
            "type": "object",
            "required": [
              "subject",
              "levelScale"
            ],
            "properties": {
              "subject": {
                "type": "string"
              },
              "levelScale": {
                "type": "string"
              },
              "level": {
                "type": "string"
              }
            },
            "additionalProperties": false
          }
        },
        "quota": {
          "type": "string",
          "description": "For kind 'minimum-average': the admission quota the floor applies to, e.g. \"Quota 1\". A scoped floor does not decide eligibility — a student below it can still be admitted another way — so the engine reports it beside the outcome rather than as a gap."
        },
        "shortLabel": {
          "type": "string",
          "description": "A shorter label for a card, where the full label is too long to scan — \"an English test (IELTS 7.0)\". The programme page shows `label`."
        },
        "alternativeTest": {
          "type": "object",
          "description": "A test the source accepts in place of this rule's minimum grade, for a student who holds the subject below it — CBS: Cambridge C1 Advanced 185 \"fulfil[s] both\" English B at 6.0 and English A. `alsoMeets` names the ids of other requirements on the same Opportunity the source says it satisfies too, so one test is counted as one step.",
          "required": ["label", "evidence"],
          "properties": {
            "label": { "type": "string" },
            "shortLabel": { "type": "string" },
            "note": { "type": "string" },
            "alsoMeets": { "type": "array", "items": { "type": "string" } },
            "evidence": { "$ref": "common.schema.json#/$defs/evidenceRefs" }
          },
          "additionalProperties": false
        },
        "openFor": {
          "type": "array",
          "description": "A question the record leaves open for one applicant group — Maastricht's deficiency date for applicants from outside the EU/EEA. Said as a \"?\" to that group; a plan that depends on it is \"Needs review\".",
          "items": {
            "type": "object",
            "required": ["applicantGroup", "question"],
            "properties": {
              "applicantGroup": { "$ref": "common.schema.json#/$defs/applicantGroup" },
              "question": { "type": "string" },
              "evenWhenMet": { "type": "boolean" }
            },
            "additionalProperties": false
          }
        },
        "openQuestion": {
          "type": "string",
          "description": "A question the record leaves open about who this rule's exemption reaches, said to the students it affects as a \"?\" rather than resolved either way — SEA exempts \"an International Baccalaureate exam\", and whether that includes Course Results is not published."
        },
        "consequence": {
          "type": "string",
          "description": "What the source says happens to an applicant who does not meet this, quoted — RUC: \"you will receive a rejection letter, regardless of whether there are fewer applicants than the number of study places\". Said beside a gap with no action."
        }
      },
      "additionalProperties": false
    }
  }
}
