{
  "id": "dk-sdu-mechatronics-beng-2027-autumn",
  "programme": "dk-sdu-mechatronics-beng",
  "institution": "dk-sdu",
  "destination": "dk",
  "place": "dk-sonderborg",
  "intake": "2027-autumn",
  "startMonth": "September",
  "language": {
    "instruction": "English",
    "fullyInLanguage": true
  },
  "admission": {
    "restricted": true,
    "selection": [
      {
        "type": "gpa",
        "description": "Quota 1 GPA floor: \"To be considered for a study place in quota 1, your GPA must be equivalent to 5.0 or higher in the Danish grading scale.\"",
        "evidence": [
          "ev-sdu-dk-lj48n8"
        ]
      }
    ],
    "historicalCutoffs": [
      {
        "intake": "2026-autumn",
        "quota": "Quota 1",
        "value": "All qualified applicants accepted",
        "scale": "dk-7-point",
        "evidence": [
          "ev-sdu-dk-lj48n8"
        ]
      }
    ]
  },
  "requirements": [
    {
      "id": "req-all-1",
      "kind": "local-equivalency",
      "mandatory": true,
      "label": "English at B level",
      "subject": "English",
      "levelScale": "dk-abc",
      "level": "B",
      "operator": "at-least",
      "applicability": {
        "intake": "2027-autumn",
        "applicantGroup": "any"
      },
      "evidence": [
        "ev-sdu-dk-lj48n8"
      ]
    },
    {
      "id": "req-all-2",
      "kind": "local-equivalency",
      "mandatory": true,
      "label": "Mathematics at A level",
      "subject": "Mathematics",
      "levelScale": "dk-abc",
      "level": "A",
      "operator": "at-least",
      "applicability": {
        "intake": "2027-autumn",
        "applicantGroup": "any"
      },
      "evidence": [
        "ev-sdu-dk-lj48n8"
      ]
    },
    {
      "id": "req-oneof",
      "kind": "subject-combination",
      "mandatory": true,
      "label": "One of 2 accepted subject combinations",
      "operator": "one-of",
      "alternatives": [
        [
          {
            "id": "req-alt1-1",
            "kind": "local-equivalency",
            "mandatory": true,
            "label": "Physics at B level",
            "subject": "Physics",
            "levelScale": "dk-abc",
            "level": "B",
            "operator": "at-least",
            "applicability": {
              "intake": "2027-autumn",
              "applicantGroup": "any"
            },
            "evidence": [
              "ev-sdu-dk-lj48n8"
            ]
          }
        ],
        [
          {
            "id": "req-alt2-1",
            "kind": "local-equivalency",
            "mandatory": true,
            "label": "Geoscience at A level",
            "subject": "Geoscience",
            "levelScale": "dk-abc",
            "level": "A",
            "operator": "at-least",
            "applicability": {
              "intake": "2027-autumn",
              "applicantGroup": "any"
            },
            "evidence": [
              "ev-sdu-dk-lj48n8"
            ]
          }
        ]
      ],
      "applicability": {
        "intake": "2027-autumn",
        "applicantGroup": "any"
      },
      "evidence": [
        "ev-sdu-dk-lj48n8"
      ]
    }
  ],
  "officialRequirementsText": [
    {
      "text": "In addition you must have passed: English level B. Mathematics level A. Physics level B or Geoscience level A. Course levels refer to the Danish high school system: A is advanced, B is intermediate, and C is beginner level.",
      "language": "en",
      "official": true
    }
  ],
  "cost": [
    {
      "applicantGroup": "eu-eea-ch",
      "feeStatus": "no-fee",
      "priceYear": "2026/27",
      "evidence": [
        "ev-sdu-dk-lj48n8"
      ]
    },
    {
      "applicantGroup": "non-eu",
      "feeStatus": "international-rate",
      "priceYear": "2026/27",
      "evidence": [
        "ev-sdu-dk-lj48n8"
      ]
    }
  ],
  "applicationRoutes": [
    "dk-optagelse-international-2027"
  ],
  "evidence": [
    "ev-sdu-dk-lj48n8"
  ],
  "meta": {
    "schemaVersion": "1.0",
    "dataAsOf": "2026-09-22",
    "notes": [
      "40 expected places; 47 admitted in 2026.",
      "Non-EU tuition at institution level: Set per programme and paid a full year in advance: EUR 17,300 per year for the engineering and IT programmes (Artificial Intelligence, Computer Science, Electronics, Engineering Innovation and Business, Interactive Technology Engineering, Mechanical, Mechatronics, Software Engineering, and the three BEng programmes) and EUR 15,000 per year for European Studies, Economics and Business Administration (Sønderborg) and Market and Management Anthropology. Application fee EUR 200 per applicant regardless of how many programmes you apply for. EU/EEA and Swiss citizens pay nothing.",
      "Which IB award opens this one is NOT established. The national rule turns on the kind of programme: DP Course Results of at least 18 points, with grade 3 in all six subjects and at least three at HL, reach erhvervsakademi- and professionsbacheloruddannelser on their own, while a universitetsbacheloruddannelse needs supplementary hf-enkeltfag on top. This is a diplomingeniør, which is a professional bachelor degree awarded by a university, and no source read here says which of the two admission orders it is admitted under — the Agency's IB guidance names programme types, not this hybrid. It is therefore left unrecorded rather than guessed, and a Course candidate is told so. Establishing it needs SDU admissions, or the scope clause of bekendtgørelsen om adgang til erhvervsakademiuddannelser og professionsbacheloruddannelser, in writing."
    ]
  }
}
